{
  "$schema": "https://json-schema.org/draft/2020-12/schema",
  "title": "Foundry Registry Idea v1",
  "type": "object",
  "additionalProperties": false,
  "required": [
    "idea_id",
    "title",
    "summary",
    "category",
    "canonical_problem",
    "canonical_pattern",
    "dedupe_key",
    "source_refs",
    "supporting_source_count",
    "contradicting_source_count",
    "confidence",
    "evidence_strength",
    "transferability",
    "expected_upside",
    "risk_reduction_value",
    "implementation_cost",
    "novelty",
    "dependency_burden",
    "score_breakdown",
    "weighted_score",
    "status",
    "review_state",
    "promotion_reason",
    "review_notes",
    "implementation_notes",
    "dependencies",
    "related_ideas",
    "queue_eligibility",
    "queue_reason",
    "first_seen_at",
    "created_at",
    "last_updated"
  ],
  "properties": {
    "idea_id": { "type": "string", "minLength": 1 },
    "title": { "type": "string", "minLength": 1 },
    "summary": { "type": "string", "minLength": 1 },
    "category": { "type": "string", "minLength": 1 },
    "canonical_problem": { "type": "string", "minLength": 1 },
    "canonical_pattern": { "type": "string", "minLength": 1 },
    "dedupe_key": { "type": "string", "minLength": 1 },
    "source_refs": { "type": "array", "items": { "type": "string" } },
    "supporting_source_count": { "type": "integer", "minimum": 0 },
    "contradicting_source_count": { "type": "integer", "minimum": 0 },
    "confidence": { "type": "integer", "minimum": 0, "maximum": 5 },
    "evidence_strength": { "type": "integer", "minimum": 0, "maximum": 5 },
    "transferability": { "type": "integer", "minimum": 0, "maximum": 5 },
    "expected_upside": { "type": "integer", "minimum": 0, "maximum": 5 },
    "risk_reduction_value": { "type": "integer", "minimum": 0, "maximum": 5 },
    "implementation_cost": { "type": "integer", "minimum": 0, "maximum": 5 },
    "novelty": { "type": "integer", "minimum": 0, "maximum": 5 },
    "dependency_burden": { "type": "integer", "minimum": 0, "maximum": 5 },
    "score_breakdown": { "type": "object" },
    "weighted_score": { "type": "number", "minimum": 0, "maximum": 100 },
    "status": {
      "type": "string",
      "enum": ["active", "watchlist", "research_next", "implement_soon", "queued", "archived", "rejected"]
    },
    "review_state": {
      "type": "string",
      "enum": ["pending_review", "approved_registry", "rejected_registry", "needs_more_research"]
    },
    "promotion_reason": { "type": "string" },
    "review_notes": { "type": "string" },
    "implementation_notes": { "type": "string" },
    "dependencies": { "type": "array", "items": { "type": "string" } },
    "related_ideas": { "type": "array", "items": { "type": "string" } },
    "queue_eligibility": { "type": "boolean" },
    "queue_reason": { "type": "string" },
    "first_seen_at": { "type": "string", "minLength": 1 },
    "created_at": { "type": "string", "minLength": 1 },
    "last_updated": { "type": "string", "minLength": 1 }
  }
}
