{
  "idea_id": "idea_cand_demo_001",
  "title": "Structured scoring contract",
  "summary": "Use explicit weighted scoring to rank ideas with auditability.",
  "category": "scoring",
  "canonical_problem": "Inconsistent promotion decisions across operators.",
  "canonical_pattern": "Compute weighted score from 8 dimensions and cap by hard gates.",
  "dedupe_key": "scoring_contract_v1",
  "source_refs": [
    "src_demo_001"
  ],
  "supporting_source_count": 1,
  "contradicting_source_count": 0,
  "confidence": 4,
  "evidence_strength": 4,
  "transferability": 4,
  "expected_upside": 4,
  "risk_reduction_value": 4,
  "implementation_cost": 2,
  "novelty": 2,
  "dependency_burden": 1,
  "score_breakdown": {
    "evidence_strength": 0.88,
    "transferability": 0.72,
    "expected_upside": 0.64,
    "risk_reduction_value": 0.56,
    "implementation_cost_inverted": 0.30000000000000004,
    "novelty": 0.16,
    "dependency_burden_inverted": 0.28,
    "confidence": 0.2,
    "raw_sum": 3.74,
    "weighted_score": 74.8
  },
  "weighted_score": 74.8,
  "status": "implement_soon",
  "review_state": "pending_review",
  "promotion_reason": "base=implement_soon | score=74.8 | dedupe=match",
  "review_notes": "",
  "implementation_notes": "",
  "dependencies": [],
  "related_ideas": [],
  "queue_eligibility": false,
  "queue_reason": "not_queue_candidate",
  "first_seen_at": "2026-04-09T00:00:00Z",
  "created_at": "2026-04-09T12:41:43.607698+00:00",
  "last_updated": "2026-04-09T12:41:43.607698+00:00"
}
